{
  "name": "CLI",
  "version": "0.1.37",
  "title": "Macroforge CLI Binary",
  "description": "This binary provides command-line utilities for working with Macroforge TypeScript macros.\nIt is designed for development workflows, enabling macro expansion and type checking\nwithout requiring Node.js integration.",
  "commands": {
    "expand": "Expands macros in TypeScript/TSX files:\n\n```bash\n# Expand a single file\nmacroforge expand src/User.ts\n\n# Expand to specific output file\nmacroforge expand src/User.ts --out dist/User.js\n\n# Scan and expand all files in a directory\nmacroforge expand --scan src/\n\n# Use only built-in Rust macros (faster, no external dependencies)\nmacroforge expand src/User.ts --builtin-only\n\n# Print expanded output to stdout\nmacroforge expand src/User.ts --print\n```",
    "tsc": "Run TypeScript type checking with macro expansion baked in:\n\n```bash\n# Type check with default tsconfig.json\nmacroforge tsc\n\n# Type check with custom tsconfig\nmacroforge tsc -p tsconfig.build.json\n```"
  },
  "outputFileNaming": "By default, expanded files are written with `.expanded` inserted before the extension:\n\n- `foo.ts` → `foo.expanded.ts`\n- `foo.svelte.ts` → `foo.expanded.svelte.ts`",
  "exitCodes": "- `0` - Success\n- `1` - Error during expansion\n- `2` - No macros found in the input file (with `--quiet` suppresses output)",
  "nodeIntegration": "By default, the CLI uses Node.js to support external/custom macros from npm packages.\nUse `--builtin-only` for fast expansion with only the built-in Rust macros (Debug, Clone,\nPartialEq, Hash, Ord, PartialOrd, Default, Serialize, Deserialize).",
  "functions": [],
  "raw": "# Macroforge CLI Binary\n\nThis binary provides command-line utilities for working with Macroforge TypeScript macros.\nIt is designed for development workflows, enabling macro expansion and type checking\nwithout requiring Node.js integration.\n\n## Commands\n\n### `macroforge expand`\n\nExpands macros in TypeScript/TSX files:\n\n```bash\n# Expand a single file\nmacroforge expand src/User.ts\n\n# Expand to specific output file\nmacroforge expand src/User.ts --out dist/User.js\n\n# Scan and expand all files in a directory\nmacroforge expand --scan src/\n\n# Use only built-in Rust macros (faster, no external dependencies)\nmacroforge expand src/User.ts --builtin-only\n\n# Print expanded output to stdout\nmacroforge expand src/User.ts --print\n```\n\n### `macroforge tsc`\n\nRun TypeScript type checking with macro expansion baked in:\n\n```bash\n# Type check with default tsconfig.json\nmacroforge tsc\n\n# Type check with custom tsconfig\nmacroforge tsc -p tsconfig.build.json\n```\n\n## Output File Naming\n\nBy default, expanded files are written with `.expanded` inserted before the extension:\n\n- `foo.ts` → `foo.expanded.ts`\n- `foo.svelte.ts` → `foo.expanded.svelte.ts`\n\n## Exit Codes\n\n- `0` - Success\n- `1` - Error during expansion\n- `2` - No macros found in the input file (with `--quiet` suppresses output)\n\n## Node.js Integration\n\nBy default, the CLI uses Node.js to support external/custom macros from npm packages.\nUse `--builtin-only` for fast expansion with only the built-in Rust macros (Debug, Clone,\nPartialEq, Hash, Ord, PartialOrd, Default, Serialize, Deserialize)."
}